{
  "buy_trades_total": 1,
  "buy_volume": "0.08",
  "classification_coverage": "0.6875",
  "confidence_weighted_coverage": "0.6875",
  "order_flow_checksum": "200585b65c124754c3e308aaf40eba2c98435ecac4f5a93815d278adcf887da0",
  "schema_version": "order-flow-state-v1",
  "sell_trades_total": 1,
  "sell_volume": "0.03",
  "signed_delta": "0.05",
  "total_volume": "0.16",
  "trades_total": 3,
  "unknown_trades_total": 1,
  "unknown_volume": "0.05",
  "unknown_volume_ratio": "0.3125",
  "windows": [
    {
      "buy_trades_total": 1,
      "buy_volume": "0.08",
      "classification_coverage": "0.6875",
      "confidence_weighted_coverage": "0.6875",
      "delta_impulse": "0.05",
      "event_time": "2026-08-06T19:18:40.000000Z",
      "receive_time": "2026-08-06T19:18:40.050000Z",
      "schema_version": "order-flow-window-v1",
      "sell_trades_total": 1,
      "sell_volume": "0.03",
      "session_id": "2026-08-06",
      "signed_delta": "0.05",
      "signed_imbalance": "0.3125",
      "total_volume": "0.16",
      "trades_total": 3,
      "unknown_trades_total": 1,
      "unknown_volume": "0.05",
      "window_checksum": "bbe4fabcc1ec72075353552a7dfbd55d21b815de7ace991df8697b78799a3ab5",
      "window_end": "2026-08-06T19:18:41.000000Z",
      "window_start": "2026-08-06T19:18:40.000000Z"
    }
  ]
}
